<?xml version="1.0" ?>
	<!DOCTYPE student SYSTEM "q-4.dtd">
	<student>
		<student_name>
		</student_name>
		<personal_info>
			<address></address>
			<birthdate></birthdate>
			<gender><male></male></gender>
			<mobile_no></mobile_no>
			<address></address>
		</personal_info>
		<result>
			<total></total>
			<percentage></percentage>
			<grade>
				<Pass></Pass>
			</grade>
		</result>
	</student>